{
  "$schema": "../../schemas/service-manifest-v1.schema.json",
  "schema_version": 1,
  "service_key": "preorder-operations",
  "purpose": "Own the versioned public preorder business lifecycle and customer-safe contracts.",
  "kind": "core_capability",
  "service_type": "dataset_owner",
  "lifecycle_status": "active",
  "functions": [
    "momi-preorder-bootstrap-v1",
    "momi-preorder-checkout-hold-v1",
    "momi-preorder-order-intent-v1",
    "momi-preorder-order-status-v1",
    "momi-preorder-quote-v1"
  ],
  "contracts": {
    "provides": [
      "momi.preorder.bootstrap.read.v1",
      "momi.preorder.change_request.submit.v1",
      "momi.preorder.checkout_hold.manage.v1",
      "momi.preorder.order_intent.create.v1",
      "momi.preorder.order_status.read.v1",
      "momi.preorder.payment.initiate.v1",
      "momi.preorder.payment.reconcile.v1",
      "momi.preorder.quote.create.v1"
    ],
    "consumes": [
      { "service": "square-payment-delivery", "contract": "square.payment.execute.v1" },
      { "service": "square-payment-acquisition", "contract": "square.payment.retrieve.v1" },
      { "service": "square-payment-acquisition", "contract": "square.payment.webhook.authenticate.v1" }
    ]
  },
  "database": {
    "read": ["momi_preorder"],
    "write": ["momi_preorder"]
  },
  "network": {
    "outbound_hosts": []
  },
  "secrets": ["SUPABASE_DB_URL"],
  "configuration": [],
  "deployment": {
    "owns": [],
    "depends_on": []
  },
  "runtime_dependencies": [
    "jsr:@supabase/functions-js@2.110.2/edge-runtime.d.ts",
    "npm:ajv@8.20.0",
    "npm:postgres@3.4.3"
  ],
  "approved_packages": [],
  "owned_dataset": {
    "dataset_key": "momi.preorder_operations",
    "dataset_class": "domain",
    "db_role": "svc_preorder_operations",
    "private_schema": "momi_preorder",
    "private_relations": [
      "momi_preorder.catalog_items",
      "momi_preorder.checkout_holds",
      "momi_preorder.commands",
      "momi_preorder.configuration_publications",
      "momi_preorder.fulfillment_windows",
      "momi_preorder.orders",
      "momi_preorder.payment_attempts",
      "momi_preorder.payment_evidence",
      "momi_preorder.public_read_rate_buckets",
      "momi_preorder.public_request_rate_buckets",
      "momi_preorder.quotes",
      "momi_preorder.surfaces"
    ],
    "private_routines": [
      "momi_preorder.admit_public_read_v1",
      "momi_preorder.admit_public_request_v1",
      "momi_preorder.authority_hash_v1",
      "momi_preorder.create_order_intent_v1",
      "momi_preorder.create_quote_v1",
      "momi_preorder.claim_payment_attempt_v1",
      "momi_preorder.claim_payment_reconciliation_v1",
      "momi_preorder.ensure_fulfillment_windows_v1",
      "momi_preorder.expire_checkout_holds_v1",
      "momi_preorder.lifecycle_failure_v1",
      "momi_preorder.manage_checkout_hold_v1",
      "momi_preorder.payment_claim_envelope_v1",
      "momi_preorder.payment_next_actions_v1",
      "momi_preorder.payment_receipt_v1",
      "momi_preorder.payment_transition_allowed_v1",
      "momi_preorder.publish_configuration_v1",
      "momi_preorder.project_payment_evidence_v1",
      "momi_preorder.quote_failure_v1",
      "momi_preorder.read_bootstrap_v1",
      "momi_preorder.read_payment_attempt_v1",
      "momi_preorder.read_order_status_v1",
      "momi_preorder.recovery_authority_v1",
      "momi_preorder.resolve_payment_attempt_v1",
      "momi_preorder.request_digest_v1",
      "momi_preorder.refresh_fulfillment_windows_on_surface_v1",
      "momi_preorder.refresh_fulfillment_windows_v1",
      "momi_preorder.validate_active_savings_policy_v1"
    ],
    "public_reads": [
      "momi.preorder.bootstrap.read.v1",
      "momi.preorder.order_status.read.v1"
    ],
    "public_commands": [
      "momi.preorder.checkout_hold.manage.v1",
      "momi.preorder.order_intent.create.v1",
      "momi.preorder.quote.create.v1"
    ],
    "public_routine_reads": [
      {
        "contract": "momi.preorder.bootstrap.read.v1",
        "routine": "momi_preorder.read_bootstrap_v1"
      },
      {
        "contract": "momi.preorder.order_status.read.v1",
        "routine": "momi_preorder.read_order_status_v1"
      }
    ],
    "public_routine_commands": [
      {
        "contract": "momi.preorder.checkout_hold.manage.v1",
        "routine": "momi_preorder.manage_checkout_hold_v1"
      },
      {
        "contract": "momi.preorder.order_intent.create.v1",
        "routine": "momi_preorder.create_order_intent_v1"
      },
      {
        "contract": "momi.preorder.quote.create.v1",
        "routine": "momi_preorder.create_quote_v1"
      }
    ],
    "emitted_events": []
  }
}
