{
  "$schema": "../../schemas/service-manifest-v1.schema.json",
  "schema_version": 1,
  "service_key": "square-payment-acquisition",
  "purpose": "Retrieve Square payment and refund observations and authenticate exact raw webhook evidence.",
  "kind": "source_adapter",
  "service_type": "procurement_adapter",
  "lifecycle_status": "active",
  "functions": [],
  "contracts": {
    "provides": ["square.payment.retrieve.v1", "square.payment.webhook.authenticate.v1"],
    "consumes": []
  },
  "database": { "read": [], "write": [] },
  "network": { "outbound_hosts": ["connect.squareupsandbox.com"] },
  "secrets": ["SQUARE_SANDBOX_ACCESS_TOKEN", "SQUARE_WEBHOOK_SIGNATURE_KEY"],
  "configuration": ["SQUARE_SANDBOX_LOCATION_ID", "SQUARE_WEBHOOK_NOTIFICATION_URL"],
  "deployment": { "owns": [], "depends_on": [] },
  "runtime_dependencies": [],
  "approved_packages": []
}
