{
  "$schema": "../../schemas/service-manifest-v1.schema.json",
  "schema_version": 1,
  "service_key": "toast-webhook-ingestion",
  "purpose": "Authenticate Toast subscriptions and submit complete envelopes for archival.",
  "kind": "source_adapter",
  "service_type": "procurement_adapter",
  "lifecycle_status": "active",
  "functions": ["toast-webhooks-ingest-v1"],
  "contracts": { "provides": ["toast.webhooks.webhook_ingest.v1"], "consumes": [] },
  "database": { "read": [], "write": ["toast_raw"] },
  "network": { "outbound_hosts": [] },
  "secrets": [
    "SUPABASE_DB_URL",
    "TOAST_ORDERS_WEBHOOK_SECRET",
    "TOAST_STOCK_WEBHOOK_SECRET",
    "TOAST_MENUS_WEBHOOK_SECRET",
    "TOAST_PACKAGING_WEBHOOK_SECRET",
    "TOAST_RESTAURANT_AVAILABILITY_WEBHOOK_SECRET",
    "TOAST_ORDERING_SCHEDULE_WEBHOOK_SECRET"
  ],
  "configuration": [],
  "deployment": { "owns": [], "depends_on": [] },
  "runtime_dependencies": [
    "jsr:@supabase/functions-js@2.110.2/edge-runtime.d.ts",
    "npm:postgres@3.4.3"
  ],
  "approved_packages": []
}
