{
  "$schema": "../../schemas/service-manifest-v1.schema.json",
  "schema_version": 1,
  "service_key": "archive-governance",
  "purpose": "Own archive coverage gaps, export runs, and evidence status.",
  "kind": "core_capability",
  "service_type": "dataset_owner",
  "lifecycle_status": "active",
  "functions": [],
  "contracts": { "provides": [], "consumes": [] },
  "database": { "read": ["momi_archive"], "write": ["momi_archive"] },
  "network": { "outbound_hosts": [] },
  "secrets": [],
  "configuration": [],
  "deployment": { "owns": [], "depends_on": [] },
  "runtime_dependencies": [],
  "approved_packages": [],
  "owned_dataset": {
    "dataset_key": "momi.archive_governance",
    "dataset_class": "operational",
    "private_schema": "momi_archive",
    "private_relations": [
      "momi_archive.export_runs",
      "momi_archive.manual_export_findings_v1",
      "momi_archive.product_export_status_v1",
      "momi_archive.product_gap_register"
    ],
    "private_routines": [
      "momi_archive.reject_export_run_mutation"
    ],
    "public_reads": [],
    "public_commands": [],
    "emitted_events": []
  }
}
