{
  "$schema": "../../schemas/service-manifest-v1.schema.json",
  "schema_version": 1,
  "service_key": "square-payment-delivery",
  "purpose": "Execute Square online payments from payment attempts durably owned by governed ordering services.",
  "kind": "destination_adapter",
  "service_type": "destination_adapter",
  "lifecycle_status": "active",
  "functions": [],
  "contracts": {
    "provides": ["square.payment.execute.v1"],
    "consumes": []
  },
  "database": { "read": [], "write": [] },
  "network": { "outbound_hosts": ["connect.squareupsandbox.com"] },
  "secrets": ["SQUARE_SANDBOX_ACCESS_TOKEN"],
  "configuration": ["SQUARE_API_VERSION", "SQUARE_SANDBOX_LOCATION_ID"],
  "deployment": { "owns": [], "depends_on": [] },
  "runtime_dependencies": [],
  "approved_packages": []
}
