{
  "$schema": "../../../../../../schemas/service-manifest-v1.schema.json",
  "schema_version": 1,
  "service_key": "fixture-no-dataset",
  "purpose": "Model a source adapter with compatibility access but no target dataset.",
  "kind": "source_adapter",
  "service_type": "procurement_adapter",
  "lifecycle_status": "active",
  "functions": [],
  "contracts": { "provides": [], "consumes": [] },
  "database": { "read": ["fixture_public"], "write": ["legacy_private"] },
  "network": { "outbound_hosts": [] },
  "secrets": [],
  "runtime_dependencies": [],
  "approved_packages": []
}
