{
  "$schema": "../../../../../../schemas/service-manifest-v1.schema.json",
  "schema_version": 1,
  "service_key": "fixture-dynamic-debt",
  "purpose": "Model service-key debt whose source lives outside a service directory.",
  "kind": "source_adapter",
  "service_type": "procurement_adapter",
  "lifecycle_status": "active",
  "functions": [],
  "contracts": { "provides": [], "consumes": [] },
  "database": { "read": [], "write": [] },
  "network": { "outbound_hosts": [] },
  "secrets": [],
  "runtime_dependencies": [],
  "approved_packages": []
}
