{
  "$schema": "../../schemas/service-manifest-v1.schema.json",
  "schema_version": 1,
  "service_key": "communications-evaluation",
  "purpose": "Evaluate immutable communication evidence into durable structured decisions.",
  "kind": "core_capability",
  "service_type": "dataset_owner",
  "lifecycle_status": "active",
  "functions": ["momi-communications-evaluate-item-v1"],
  "contracts": {
    "provides": [
      "momi.communications.dispatch_evaluation_job.v1",
      "momi.communications.evaluate_item.v1",
      "momi.communications.get_evaluation_job_status.v1",
      "momi.communications.get_evaluation_queue_status.v1"
    ],
    "consumes": [
      {"service": "model-execution-gateway", "contract": "momi.model_execution.execute.v1"}
    ]
  },
  "database": {
    "read": ["momi_communications"],
    "write": ["momi_communications"]
  },
  "network": { "outbound_hosts": ["same-origin:supabase-edge-functions"] },
  "secrets": ["SUPABASE_DB_URL", "MOMI_MODEL_GATEWAY_EVALUATION_SECRET"],
  "configuration": ["MOMI_MODEL_EXECUTION_GATEWAY_URL"],
  "deployment": {
    "owns": [
      { "kind": "cron_job", "key": "momi-communications-evaluator-wakeup-v1" }
    ],
    "depends_on": [
      { "kind": "postgres_extension", "key": "pg_cron" },
      { "kind": "postgres_extension", "key": "pg_net" },
      { "kind": "vault_secret", "key": "momi_project_url" },
      { "kind": "vault_secret", "key": "momi_publishable_key" }
    ]
  },
  "runtime_dependencies": [
    "jsr:@supabase/functions-js@2.110.2/edge-runtime.d.ts",
    "npm:postgres@3.4.3"
  ],
  "approved_packages": [],
  "owned_dataset": {
    "dataset_key": "momi.communication_evaluation",
    "dataset_class": "domain",
    "private_relations": [
      "momi_communications.audit_events",
      "momi_communications.communication_evaluations",
      "momi_communications.corrections",
      "momi_communications.derived_records",
      "momi_communications.evaluation_jobs"
    ],
    "private_routines": [
      "momi_communications.claim_evaluation_job_v1",
      "momi_communications.complete_evaluation_job_v1",
      "momi_communications.dispatch_evaluation_job_v1",
      "momi_communications.fail_evaluation_job_v1",
      "momi_communications.get_evaluation_job_status_v1",
      "momi_communications.get_evaluation_queue_status_v1",
      "momi_communications.wake_communications_evaluator"
    ],
    "public_reads": [
      "momi.communications.get_evaluation_job_status.v1",
      "momi.communications.get_evaluation_queue_status.v1"
    ],
    "public_commands": [
      "momi.communications.dispatch_evaluation_job.v1",
      "momi.communications.evaluate_item.v1"
    ],
    "public_routine_reads": [
      { "contract": "momi.communications.get_evaluation_job_status.v1", "routine": "momi_communications.get_evaluation_job_status_v1" },
      { "contract": "momi.communications.get_evaluation_queue_status.v1", "routine": "momi_communications.get_evaluation_queue_status_v1" }
    ],
    "emitted_events": []
  }
}
