{
  "$schema": "../../schemas/service-manifest-v1.schema.json",
  "schema_version": 1,
  "service_key": "warehouse-projection",
  "purpose": "Own the canonical warehouse and project durable raw evidence into it.",
  "kind": "core_capability",
  "service_type": "dataset_owner",
  "lifecycle_status": "active",
  "functions": ["momi-warehouse-projection-worker-v1"],
  "contracts": {
    "provides": [
      "momi.warehouse.canonical_read_views.v1",
      "momi.warehouse.toast_order_read_view.v1",
      "momi.warehouse_projection.toast.consume.v1"
    ],
    "consumes": [
      { "service": "runtime-registry", "contract": "momi.runtime.active_trigger_resolution.v1" },
      { "service": "communications-archive", "contract": "toast.archive.warehouse_projection_input.v1" },
      { "service": "momi-event-routing", "contract": "momi.events.delivery_lifecycle.v1" },
      { "service": "momi-event-routing", "contract": "momi.events.delivery_reference.v1" },
      { "service": "momi-event-routing", "contract": "momi.events.delivery_witness.v1" },
      { "service": "momi-event-routing", "contract": "momi.events.warehouse_append.v1" },
      { "service": "momi-event-routing", "contract": "momi.events.warehouse_delivery_reservation.v1" },
      { "service": "toast-data-acquisition", "contract": "toast.acquisition.projection_job_mode.v1" },
      { "service": "toast-data-acquisition", "contract": "toast.acquisition.stock_snapshot_projection_job.v1" }
    ]
  },
  "database": {
    "read": [
      "momi_api", "momi_events", "toast_acquisition", "toast_raw",
      "warehouse_projection"
    ],
    "write": [
      "momi_events", "momi_warehouse", "toast_acquisition", "warehouse_projection"
    ]
  },
  "network": { "outbound_hosts": [] },
  "secrets": ["SUPABASE_DB_URL"],
  "configuration": [],
  "deployment": {
    "owns": [
      { "kind": "cron_job", "key": "momi-warehouse-projection-database-v1" },
      { "kind": "cron_job", "key": "momi-warehouse-projection-wakeup-v1" },
      { "kind": "database_processor", "key": "warehouse_projection.process_delivery_batch" }
    ],
    "depends_on": [
      { "kind": "postgres_extension", "key": "pg_cron" },
      { "kind": "postgres_extension", "key": "pg_net" },
      { "kind": "postgres_extension", "key": "pgmq" },
      { "kind": "vault_secret", "key": "momi_project_url" },
      { "kind": "vault_secret", "key": "momi_publishable_key" }
    ]
  },
  "runtime_dependencies": [
    "jsr:@supabase/functions-js@2.110.2/edge-runtime.d.ts",
    "npm:postgres@3.4.3"
  ],
  "approved_packages": [],
  "owned_dataset": {
    "dataset_key": "momi.canonical_warehouse",
    "db_role": "svc_warehouse_projection",
    "dataset_class": "domain",
    "private_relations": [
      "momi_api.employees_by_id_v1", "momi_api.menu_entities_by_id_v1",
      "momi_api.order_versions_by_id_v1", "momi_api.orders_by_id_v1",
      "momi_api.payments_by_id_v1", "momi_api.schedules_by_id_v1",
      "momi_api.stock_observations_latest_v1",
      "momi_api.toast_order_alert_presentations_v1",
      "momi_api.toast_order_source_versions_v1",
      "momi_api.toast_orders_by_id_v1",
      "momi_api.warehouse_entities_by_id_v1",
      "momi_warehouse.entities",
      "momi_warehouse.entity_versions",
      "momi_warehouse.menu_universe_items",
      "momi_warehouse.menu_universe_observations",
      "momi_warehouse.menu_universe_versions",
      "momi_warehouse.source_links",
      "momi_warehouse.stock_observations",
      "momi_warehouse.version_observations",
      "warehouse_projection.canonical_resource_replay_v2",
      "warehouse_projection.delivery_reservations",
      "warehouse_projection.worker_settings",
      "warehouse_projection.sales_source_entities_v1"
    ],
    "private_routines": [
      "warehouse_projection.begin_reserved_delivery", "warehouse_projection.build_toast_menu_edges",
      "warehouse_projection.canonical_entity_type", "warehouse_projection.canonical_menu_document",
      "warehouse_projection.canonical_menu_sales_channels", "warehouse_projection.canonical_resource_document_v2",
      "warehouse_projection.canonical_toast_order_document_v2", "warehouse_projection.canonical_toast_ordering_schedule_document",
      "warehouse_projection.claim_database_delivery",
      "warehouse_projection.enforce_edge_reservation_mode", "warehouse_projection.link_source_entity",
      "warehouse_projection.process_delivery_batch", "warehouse_projection.project_and_ack_delivery",
      "warehouse_projection.project_staged_menu_entities", "warehouse_projection.project_toast_archived_order",
      "warehouse_projection.project_toast_daily_stock_snapshot", "warehouse_projection.project_toast_event",
      "warehouse_projection.project_toast_menu_document", "warehouse_projection.project_toast_order",
      "warehouse_projection.project_toast_resource_observation", "warehouse_projection.project_toast_stock_observation",
      "warehouse_projection.project_toast_stock_snapshot", "warehouse_projection.project_toast_stock_webhook",
      "warehouse_projection.record_entity_version", "warehouse_projection.reserve_internal_delivery",
      "warehouse_projection.resolve_source_entity", "warehouse_projection.resolve_toast_stock_item",
      "warehouse_projection.rotate_projection_delivery_capability", "warehouse_projection.stage_toast_menu_nodes",
      "warehouse_projection.stage_toast_menu_references",
      "warehouse_projection.staged_menu_relationships", "warehouse_projection.toast_fulfillment_mode",
      "warehouse_projection.toast_order_presentation_v1", "warehouse_projection.toast_schedule_date",
      "warehouse_projection.toast_schedule_day", "warehouse_projection.toast_schedule_time",
      "warehouse_projection.try_timestamptz", "warehouse_projection.wake_next_delivery", "warehouse_projection.wake_projection_worker"
    ],
    "public_reads": [
      "momi.warehouse.canonical_read_views.v1",
      "momi.warehouse.toast_order_read_view.v1"
    ],
    "public_relation_reads": [
      { "contract": "momi.warehouse.canonical_read_views.v1", "relation": "warehouse_projection.sales_source_entities_v1" },
      { "contract": "momi.warehouse.canonical_read_views.v1", "relation": "momi_api.employees_by_id_v1" },
      { "contract": "momi.warehouse.canonical_read_views.v1", "relation": "momi_api.menu_entities_by_id_v1" },
      { "contract": "momi.warehouse.canonical_read_views.v1", "relation": "momi_api.order_versions_by_id_v1" },
      { "contract": "momi.warehouse.canonical_read_views.v1", "relation": "momi_api.orders_by_id_v1" },
      { "contract": "momi.warehouse.canonical_read_views.v1", "relation": "momi_api.payments_by_id_v1" },
      { "contract": "momi.warehouse.canonical_read_views.v1", "relation": "momi_api.schedules_by_id_v1" },
      { "contract": "momi.warehouse.canonical_read_views.v1", "relation": "momi_api.stock_observations_latest_v1" },
      { "contract": "momi.warehouse.canonical_read_views.v1", "relation": "momi_api.warehouse_entities_by_id_v1" },
      { "contract": "momi.warehouse.toast_order_read_view.v1", "relation": "momi_api.toast_orders_by_id_v1" }
    ],
    "public_commands": ["momi.warehouse_projection.toast.consume.v1"],
    "emitted_events": [
      "warehouse.order.archived",
      "warehouse.order.observed",
      "warehouse.order.reconciled",
      "warehouse.entity.observed",
      "warehouse.menu_entity.observed", "warehouse.stock.observed", "warehouse.stock_snapshot.observed"
    ]
  }
}
