{
  "$schema": "../../schemas/service-manifest-v1.schema.json",
  "schema_version": 1,
  "service_key": "communications-gateway",
  "purpose": "Admit bounded provider-neutral assistant turns and explicit user logging.",
  "kind": "core_capability",
  "service_type": "dataset_owner",
  "lifecycle_status": "active",
  "functions": ["momi-communications-gateway-v1"],
  "contracts": {
    "provides": [
      "momi.communications.list_models.v1",
      "momi.communications.chat_completions.v1",
      "momi.communications.complete_background.v1",
      "momi.communications.create_explicit_log.v1",
      "momi.communications.get_conversation_execution.v1",
      "momi.communications.openwebui_delivery.v1",
      "momi.communications.set_user_limits.v1",
      "momi.communications.set_user_routing.v1",
      "momi.communications.set_user_access.v1",
      "momi.communications.set_gateway_state.v1"
    ],
    "consumes": [
      {"service": "communications-archive", "contract": "momi.communications.capture_gateway_exchange.v1"},
      {"service": "communications-archive", "contract": "momi.communications.get_gateway_exchange_receipt.v1"},
      {"service": "communications-operations", "contract": "momi.communications.create_user_flagged_shop_log.v1"},
      {"service": "model-execution-gateway", "contract": "momi.model_execution.execute.v1"},
      {"service": "model-execution-gateway", "contract": "momi.model_execution.retrieve.v1"},
      {"service": "warehouse-read-api", "contract": "momi.canonical_beta_query.v1"},
      {"service": "warehouse-read-api", "contract": "momi.shop_analysis_query.v1"}
    ]
  },
  "database": {
    "read": [
      "momi_api",
      "momi_analysis",
      "momi_communications",
      "momi_communications_gateway",
      "momi_communications_operations"
    ],
    "write": ["momi_communications_gateway"]
  },
  "network": {"outbound_hosts": ["same-origin:supabase-edge-functions"]},
  "secrets": [
    "SUPABASE_DB_URL",
    "MOMI_MODEL_COMPLETION_CALLBACK_SECRET",
    "MOMI_MODEL_GATEWAY_COMMUNICATIONS_SECRET",
    "MOMI_OPENWEBUI_GATEWAY_SECRET",
    "MOMI_GATEWAY_ADMIN_SECRET"
  ],
  "configuration": ["DENO_DEPLOYMENT_ID", "MOMI_BETA_ADMIN_USER_ID",
    "MOMI_MODEL_EXECUTION_GATEWAY_URL"],
  "deployment": {"owns": [], "depends_on": []},
  "runtime_dependencies": [
    "jsr:@supabase/functions-js@2.110.2/edge-runtime.d.ts",
    "npm:pgsql-ast-parser@12.0.2",
    "npm:postgres@3.4.3"
  ],
  "approved_packages": [],
  "owned_dataset": {
    "dataset_key": "momi.communications_gateway",
    "dataset_class": "operational",
    "db_role": "svc_communications_gateway",
    "private_schema": "momi_communications_gateway",
    "private_relations": [
      "momi_communications_gateway.access_entries",
      "momi_communications_gateway.assistant_context",
      "momi_communications_gateway.audit_events",
      "momi_communications_gateway.async_rounds",
      "momi_communications_gateway.gateway_state",
      "momi_communications_gateway.invocations",
      "momi_communications_gateway.openwebui_deliveries",
      "momi_communications_gateway.provider_bindings",
      "momi_communications_gateway.routing_policy",
      "momi_communications_gateway.routing_profiles",
      "momi_communications_gateway.user_limits"
    ],
    "private_routines": [
      "momi_communications_gateway.admit_invocation_v1",
      "momi_communications_gateway.admit_log_invocation_v1",
      "momi_communications_gateway.admit_routed_invocation_v2",
      "momi_communications_gateway.ack_openwebui_delivery_v1",
      "momi_communications_gateway.authorize_provider_attempt_v2",
      "momi_communications_gateway.claim_async_round_v1",
      "momi_communications_gateway.claim_openwebui_delivery_v1",
      "momi_communications_gateway.complete_invocation_v1",
      "momi_communications_gateway.complete_invocation_v2",
      "momi_communications_gateway.complete_log_invocation_v1",
      "momi_communications_gateway.continue_async_round_v1",
      "momi_communications_gateway.fail_invocation_v1",
      "momi_communications_gateway.finish_async_round_v1",
      "momi_communications_gateway.get_conversation_execution_v1",
      "momi_communications_gateway.get_invocation_replay_v1",
      "momi_communications_gateway.list_models_v1",
      "momi_communications_gateway.mark_archive_admitted_v1",
      "momi_communications_gateway.mark_provider_started_v1",
      "momi_communications_gateway.retry_async_round_v1",
      "momi_communications_gateway.retry_openwebui_delivery_v1",
      "momi_communications_gateway.set_gateway_state_v1",
      "momi_communications_gateway.set_user_access_v1",
      "momi_communications_gateway.set_user_limits_v1",
      "momi_communications_gateway.set_user_routing_v1",
      "momi_communications_gateway.stage_async_round_v1"
    ],
    "public_reads": [
      "momi.communications.get_conversation_execution.v1",
      "momi.communications.list_models.v1"
    ],
    "public_commands": [
      "momi.communications.chat_completions.v1",
      "momi.communications.create_explicit_log.v1",
      "momi.communications.set_user_limits.v1",
      "momi.communications.set_user_routing.v1",
      "momi.communications.set_user_access.v1",
      "momi.communications.set_gateway_state.v1"
    ],
    "public_routine_reads": [
      {"contract": "momi.communications.get_conversation_execution.v1", "routine": "momi_communications_gateway.get_conversation_execution_v1"},
      {"contract": "momi.communications.list_models.v1", "routine": "momi_communications_gateway.list_models_v1"}
    ],
    "public_routine_commands": [
      {"contract": "momi.communications.chat_completions.v1", "routine": "momi_communications_gateway.admit_routed_invocation_v2"},
      {"contract": "momi.communications.create_explicit_log.v1", "routine": "momi_communications_gateway.admit_log_invocation_v1"},
      {"contract": "momi.communications.set_user_limits.v1", "routine": "momi_communications_gateway.set_user_limits_v1"},
      {"contract": "momi.communications.set_user_routing.v1", "routine": "momi_communications_gateway.set_user_routing_v1"},
      {"contract": "momi.communications.set_user_access.v1", "routine": "momi_communications_gateway.set_user_access_v1"},
      {"contract": "momi.communications.set_gateway_state.v1", "routine": "momi_communications_gateway.set_gateway_state_v1"}
    ],
    "emitted_events": []
  }
}
